CODE,DESCRIPTION,MAJOR_CATEGORY,MINOR_CATEGORY
PI106,Patient payment option/election not in effect.,Coverage/Eligibility,Coverage/Eligibility
PI107,Payment adjusted for failure to obtain treatment authorization,Authorization/Precert,Authorization/Precert
PI108,Payment adjusted because rent/purchase guidelines were not met.,Coverage/Eligibility,Coverage/Eligibility
PI109,Claim not covered by this payer/contractor. You must send the claim to the correct payer/contractor.,Coverage/Eligibility,Coverage/Eligibility
PI11,The diagnosis is inconsistent with the procedure,Provider Billing Error,Provider Billing Error/Diagnosis
PI110,Billing date predates service date.,Provider Billing Error,Provider Billing Error/Other
PI111,Not covered unless the provider accepts assignment.,Coverage/Eligibility,Coverage/Eligibility
PI112,Payment adjusted as not furnished directly to the patient and/or not documented.,Coverage/Eligibility,Coverage/Eligibility
PI113,Payment denied because service/procedure was provided outside the United States or as a result of war.,Coverage/Eligibility,Coverage/Eligibility
PI114,Procedure/product not approved by the Food and Drug Administration.,Coverage/Eligibility,Coverage/Eligibility
PI115,Payment adjusted as procedure postponed or canceled.,Medical Necessity/Review,Medical Necessity/Review
PI116,Payment denied. The advance indemnification notice signed by the patient did not comply with requirements.,Coverage/Eligibility,Coverage/Eligibility
PI117,Payment adjusted because transportation is only covered to the closest facility that can provide the necessary care.,Coverage/Eligibility,Coverage/Transport
PI118,Charges reduced for ESRD network support.,Coverage/Eligibility,Coverage/Transport
PI119,Benefit maximum for this time period or occurrence has been reached.,Benefit Limits,Benefit Limits
PI12,The diagnosis is inconsistent with the provider type.,Provider Billing Error,Provider Billing Error/Diagnosis
PI120,Patient is covered by a managed care plan.,Contractual/Payment,Contractual/UCR
PI121,Indemnification adjustment.,Contractual/Payment,Contractual/Payment/Other
PI122,Psychiatric reduction.,Contractual/Payment,Contractual/Payment/Other
PI123,Payer refund due to overpayment.,Refund/Recovery,Refund/Recovery
PI124,Payer refund amount - not our patient.,Refund/Recovery,Refund/Recovery
PI125,Payment adjusted due to a submission/billing error(s). Additional information is supplied using the remittance advice remarks codes whenever appropriate. This change to be effective 4/1/2007: At least one Remark Code must be provided.,Provider Billing Error,Provider Billing Error/Other
PI126,Deductible -- Major Medical,Patient Responsibility,Patient Responsibility/Deductible
PI127,Coinsurance -- Major Medical,Patient Responsibility,Patient Responsibility/Coinsurance
PI128,Newborn's services are covered under the mother's plan,Coverage/Eligibility,Coverage/Eligibility
PI129,Prior processing information appears incorrect,COB/Other Payer,COB/Other Payer
PI13,The date of death precedes the date of service.,Provider Billing Error,Provider Billing Error/Other
PI130,Claim submission fee.,Contractual/Payment,Contractual/Payment/Other
PI131,Claim specific negotiated discount.,Program/Demo Adjustment,Program/Demo
PI132,Prearranged demonstration project adjustment.,Program/Demo Adjustment,Program/Demo
PI133,The disposition of this claim/service is pending further review.,Pending/Processing,Pending/Review
PI134,Technical fees removed from charges.,Bundled/Inclusive,Bundled/Inclusive
PI135,Claim denied. Interim bills cannot be processed.,Provider Billing Error,Provider Billing Error/Other
PI136,Claim adjusted based on failure to follow prior payer's coverage rules. (Use Group Code OA).,Coverage/Eligibility,Coverage/Eligibility
PI137,"Payment/Reduction for Regulatory Surcharges, Assessments, Allowances or Health Related Taxes.",Contractual/Payment,Contractual/Payment/Other
PI138,Claim/service denied. Appeal procedures not followed or time limits not met.,Appeals/Timely Filing,Appeals/Timely Filing
PI139,Contracted funding agreement - Subscriber is employed by the provider of services.,Contractual/Payment,Contractual/Payment/Other
PI14,The date of birth follows the date of service.,Provider Billing Error,Provider Billing Error/Other
PI140,Patient/Insured health identification number and name do not match.,Provider Billing Error,Provider Billing Error/Other
PI141,Claim adjustment because the claim spans eligible and ineligible periods of coverage.,Coverage/Eligibility,Coverage/Eligibility
PI142,Claim adjusted by the monthly Medicaid patient liability amount.,Contractual/Payment,Contractual/Payment/Other
PI143,Portion of payment deferred.,Contractual/Payment,Contractual/Payment/Other
PI144,"Incentive adjustment, e.g. preferred product/service.",Contractual/Payment,Contractual/Payment/Other
PI145,Premium payment withholding,Contractual/Payment,Contractual/Payment/Other
PI146,Diagnosis was invalid for the date(s) of service reported,Provider Billing Error,Provider Billing Error/Diagnosis
PI147,Provider contracted/negotiated rate expired on the date of service,Appeals/Timely Filing,Appeals/Timely Filing
PI148,Information from another provider was not provided,Documentation/Attachments,Documentation/Attachments
PI149,Lifetime benefit maximum has been reached for this service/benefit category.,Benefit Limits,Benefit Limits
PI15,"The authorization number is missing, invalid, or does not apply",Authorization/Precert,Authorization/Precert
PI150,Payment adjusted because the payer deems the information submitted does not support this level of service.,Medical Necessity/Review,Medical Necessity/Review
PI151,Payment adjusted because the payer deems the information submitted does not support this many services.,Medical Necessity/Review,Medical Necessity/Review
PI152,Payment adjusted because the payer deems the information submitted does not support this length of service.,Medical Necessity/Review,Medical Necessity/Review
PI153,Payment adjusted because the payer deems the information submitted does not support this dosage.,Medical Necessity/Review,Medical Necessity/Review
PI154,Payment adjusted because the payer deems the information submitted does not support this day's supply.,Documentation/Attachments,Documentation/Attachments
PI155,This claim is denied because the patient refused the service/procedure.,Medical Necessity/Review,Medical Necessity/Review
PI156,Flexible spending account payments,Pending/Processing,Pending/Review
PI157,Payment denied/reduced because service/procedure was provided as a result of an act of war.,Coverage/Eligibility,Coverage/Eligibility
PI158,Payment denied/reduced because the service/procedure was provided outside of the United States.,Coverage/Eligibility,Coverage/Eligibility
PI159,Payment denied/reduced because the service/procedure was provided as a result of terrorism.,Coverage/Eligibility,Coverage/Eligibility
PI16,Claim/service lacks information which is needed for adjudication. Additional information is supplied using remittance advice remarks codes whenever appropriate. This change to be effective 4/1/2007: At least one Remark Code must be provided.,Provider Billing Error,Provider Billing Error/Other
PI160,Payment denied/reduced because injury/illness was the result of an activity that is a benefit exclusion.,Coverage/Eligibility,Coverage/Eligibility
PI161,Provider performance bonus,Contractual/Payment,Contractual/Payment/Other
PI162,"State-mandated Requirement for Property and Casualty, see Claim Payment Remarks Code for specific explanation.",Regulatory/Sequestration,Regulatory/Sequestration
PI163,Claim/Service adjusted because the attachment referenced on the claim was not received.,Documentation/Attachments,Documentation/Attachments
PI164,Claim/Service adjusted because the attachment referenced on the claim was not received in a timely fashion.,Documentation/Attachments,Documentation/Attachments
PI165,"Payment denied /reduced for absence of, or exceeded referral",Documentation/Attachments,Documentation/Attachments
PI166,These services were submitted after this payers responsibility for processing claims under this plan ended.,Documentation/Attachments,Documentation/Attachments
PI167,This (these) diagnosis(es) is (are) not covered.,Provider Billing Error,Provider Billing Error/Diagnosis
PI168,Payment denied as Service(s) have been considered under the patient's medical plan. Benefits are not available under this dental plan,Patient Responsibility,Patient Responsibility/Deductible
PI169,Alternate benefit has been provided,Contractual/Payment,Contractual/Payment/Other
PI17,Payment adjusted because requested information was not provided or was insufficient/incomplete. Additional information is supplied using the remittance advice remarks codes whenever appropriate. At least one Remark Code must be provided.,Documentation/Attachments,Documentation/Attachments
PI170,Payment is denied when performed/billed by this type of provider.,Coverage/Eligibility,Coverage/Eligibility
PI171,Payment is denied when performed/billed by this type of provider in this type of facility.,Network/Provider Contract,Network/Provider Credential
PI172,Payment is adjusted when performed/billed by a provider of this specialty,Provider Billing Error,Provider Billing Error/Other
PI173,Payment adjusted because this service was not prescribed by a physician,Coverage/Eligibility,Coverage/Eligibility
PI174,Payment denied because this service was not prescribed prior to delivery,Coverage/Eligibility,Coverage/Eligibility
PI175,Payment denied because the prescription is incomplete,Coverage/Eligibility,Coverage/Eligibility
PI176,Payment denied because the prescription is not current,Coverage/Eligibility,Coverage/Eligibility
PI177,Payment denied because the patient has not met the required eligibility requirements,Coverage/Eligibility,Coverage/Eligibility
PI178,Payment adjusted because the patient has not met the required spend down requirements.,Documentation/Attachments,Documentation/Attachments
PI179,Payment adjusted because the patient has not met the required waiting requirements,Medical Necessity/Review,Medical Necessity/Review
PI18,Duplicate claim/service.,Provider Billing Error,Provider Billing Error/Duplicate
PI180,Payment adjusted because the patient has not met the required residency requirements,Contractual/Payment,Contractual/UCR
PI181,Payment adjusted because this procedure code was invalid on the date of service,Provider Billing Error,Provider Billing Error/Coding
PI182,Procedure modifier was invalid on the date of service,Provider Billing Error,Provider Billing Error/Modifier
PI183,The referring provider is not eligible to refer the service billed.,Network/Provider Contract,Network/Provider Credential
PI184,The prescribing/ordering provider is not eligible to prescribe/order the service billed.,Network/Provider Contract,Network/Provider Credential
PI185,The rendering provider is not eligible to perform the service billed.,Network/Provider Contract,Network/Provider Credential
PI186,Payment adjusted since the level of care changed,Contractual/Payment,Contractual/Payment/Other
PI187,Health Savings account payments,Pending/Processing,Pending/Review
PI188,This product/procedure is only covered when used according to FDA recommendations.,Coverage/Eligibility,Coverage/Eligibility
PI189,'Not otherwise classified' or 'unlisted' procedure code (CPT/HCPCS) was billed when there is a specific procedure code for this procedure/service,Provider Billing Error,Provider Billing Error/Coding
PI19,This is a work-related injury/illness,Other Insurance,Coverage/Workers Comp
PI190,Payment is included in the allowance for a Skilled Nursing Facility (SNF) qualified stay.,Documentation/Attachments,Documentation/Attachments
PI191,Claim denied because this is not a work related injury/illness and thus not the liability of the workers' compensation carrier.,Other Insurance,COB/No Fault
PI192,Non standard adjustment code from paper remittance advice.,Contractual/Payment,Contractual/Payment/Other
PI193,Original payment decision is being maintained. This claim was processed properly the first time.,Appeals/Timely Filing,Appeals/Timely Filing
PI194,"Payment adjusted when anesthesia is performed by the operating physician, the assistant surgeon or the attending physician",Bundled/Inclusive,Bundled/Inclusive
PI195,Payment denied/reduced due to a refund issued to an erroneous priority payer for this claim/service,Refund/Recovery,Refund/Recovery
PI196,Claim/service denied based on prior payer's coverage determination.,Coverage/Eligibility,Coverage/Eligibility
PI197,Precertification/authorization/notification absent,Authorization/Precert,Authorization/Precert
PI198,"Payment denied/reduced for exceeded, precertification/authorization",Authorization/Precert,Authorization/Precert
PI199,Revenue code and Procedure code do not match.,Provider Billing Error,Provider Billing Error/Coding
PI2,Coinsurance Amount,Patient Responsibility,Patient Responsibility/Coinsurance
PI20,This injury/illness is covered by the liability carrier,Other Insurance,COB/No Fault
PI200,Expenses incurred during lapse in coverage,Coverage/Eligibility,Coverage/Eligibility
PI201,Workers Compensation case settled. Patient is responsible for amount of this claim/service through WC 'Medicare set aside arrangement' or other agreement. (Use group code PR).,Other Insurance,Coverage/Workers Comp
PI204,This service/equipment/drug is not covered,Coverage/Eligibility,Coverage/Eligibility
PI21,Claim denied because this injury/illness is the liability of the no-fault carrier.,Other Insurance,COB/No Fault
PI216,New Patient qualifications were not met,Coverage/Eligibility,Coverage/Eligibility/Other
PI22,This care may be covered by another payer,Other Insurance,Other Insurance/Other
PI226,Information requested from billing/treating provider not provided,Documentation/Attachments,Documentation/Attachments
PI23,Payment adjusted due to the impact of prior payer(s) adjudication including payments and/or adjustments,COB/Other Payer,COB/Other Payer
PI234,This procedure is not paid separately,Bundled/Inclusive,Bundled/Inclusive
PI24,Payment for charges adjusted. Charges are covered under a capitation agreement/managed care plan.,Contractual/Payment,Contractual/UCR
PI242,Services not provided by network/primary care provider,Network/Provider Contract,Network/Provider Contract
PI25,Payment denied. Your Stop loss deductible has not been met.,Patient Responsibility,Patient Responsibility/Deductible
PI251,Attachment/other documentation did not contain required content,Documentation/Attachments,Documentation/Attachments
PI252,AN ATTACHMENT AND OTHER DOCUMENTATION IS REQUIRED AT LEAST ONE REMARK CODE NOT PROVIDED,Documentation/Attachments,Documentation/Attachments
PI253,Sequestration - reduction in federal payment,Regulatory/Sequestration,Regulatory/Sequestration
PI26,Expenses incurred prior to coverage,Coverage/Eligibility,Coverage/Eligibility
PI27,Expenses incurred after coverage terminated.,Coverage/Eligibility,Coverage/Eligibility
PI28,Coverage not in effect at the time the service was provided.,Coverage/Eligibility,Coverage/Eligibility
PI29,The time limit for filing has expired.,Appeals/Timely Filing,Appeals/Timely Filing
PI299,The billing provider is not eligible to receive payment for the service billed.,Network/Provider Contract,Network/Provider Credential
PI3,Co-payment Amount,Patient Responsibility,Patient Responsibility/Copay
PI30,"Payment adjusted because the patient has not met the required eligibility, spend down, waiting, or residency requirements.",Contractual/Payment,Contractual/Payment/Other
PI31,Claim denied as patient cannot be identified as our insured.,Coverage/Eligibility,Coverage/Eligibility
PI32,Our records indicate that this dependent is not an eligible dependent as defined.,Documentation/Attachments,Documentation/Attachments
PI33,Claim denied. Insured has no dependent coverage.,Coverage/Eligibility,Coverage/Eligibility
PI34,Claim denied. Insured has no coverage for newborns.,Coverage/Eligibility,Coverage/Eligibility
PI35,Lifetime benefit maximum has been reached.,Benefit Limits,Benefit Limits
PI36,Balance does not exceed co-payment amount.,Patient Responsibility,Patient Responsibility/Copay
PI37,Balance does not exceed deductible.,Patient Responsibility,Patient Responsibility/Deductible
PI38,Services not provided or not provided as frequently as billed,Provider Billing Error,Provider Billing Error/Other
PI39,Services denied at the time authorization/pre-certification was requested.,Authorization/Precert,Authorization/Precert
PI4,The procedure code is inconsistent with the modifier used,Provider Billing Error,Provider Billing Error/Modifier
PI40,Charges do not meet qualifications for emergent/urgent care,Coverage/Eligibility,Coverage/Eligibility
PI41,Discount agreed to in Preferred Provider contract.,Provider Billing Error,Provider Billing Error/Coding
PI42,Procedure code was not valid on date of service,Provider Billing Error,Provider Billing Error/Coding
PI43,Gramm-Rudman reduction.,Provider Billing Error,Provider Billing Error/Coding
PI44,Prompt-pay discount,Contractual/Payment,Contractual/Payment/Other
PI45,Charges exceed your contracted/ legislated fee arrangement. This change to be effective 6/1/07: Charge exceeds fee schedule/maximum allowable or contracted/legislated fee arrangement. (Use Group Codes PR or CO depending upon liability).,Contractual/Payment,Contractual/UCR
PI46,This (these) service(s) is (are) not covered.,Authorization/Precert,Authorization/Precert
PI47,"This (these) diagnosis(es) is (are) not covered, missing, or are invalid.",Provider Billing Error,Provider Billing Error/Diagnosis
PI48,This (these) procedure(s) is (are) not covered.,Other Insurance,Coverage/Workers Comp
PI49,These are non-covered services because this is a routine exam or screening procedure done in conjunction with a routine exam.,Coverage/Eligibility,Coverage/Eligibility
PI5,The procedure code/bill type is inconsistent with the place of service,Provider Billing Error,Provider Billing Error/POS
PI50,These are non-covered services because this is not deemed a 'medical necessity' by the payer.,Medical Necessity/Review,Medical Necessity/Review
PI51,These are non-covered services. Payment included in allowance for another service,Bundled/Inclusive,Bundled/Inclusive
PI52,The referring/prescribing/rendering provider is not eligible to refer/prescribe/order/perform the service billed.,Network/Provider Contract,Network/Provider Credential
PI53,Services by an immediate relative or a member of the same household are not covered.,Coverage/Eligibility,Coverage/Eligibility
PI54,Multiple physicians/assistants are not covered in this case .,Coverage/Eligibility,Coverage/Eligibility
PI55,Claim/service denied because procedure/treatment is deemed experimental/investigational by the payer.,Medical Necessity/Review,Medical Necessity/Review
PI56,Claim/service denied because procedure/treatment has not been deemed 'proven to be effective' by the payer.,Medical Necessity/Review,Medical Necessity/Review
PI57,"Payment denied/reduced because the payer deems the information submitted does not support this level of service, this many services, this length of service, this dosage, or this day's supply.",Coverage/Eligibility,Coverage/Eligibility
PI58,Payment adjusted because treatment was deemed by the payer to have been rendered in an inappropriate or invalid place of service.,Provider Billing Error,Provider Billing Error/POS
PI5836,Payer-specific reduction code 5836 (description pending),Payer Specific,Other/Unspecified
PI59,Charges are adjusted based on multiple surgery rules or concurrent anesthesia rules.,Bundled/Inclusive,Bundled/Inclusive
PI6,The procedure/revenue code is inconsistent with the patient's age.,Provider Billing Error,Provider Billing Error/Coding
PI60,Charges for outpatient services with this proximity to inpatient services are not covered.,Bundled/Inclusive,Bundled/Inclusive
PI61,Charges adjusted as penalty for failure to obtain second surgical opinion.,Coverage/Eligibility,Coverage/Eligibility
PI62,"Payment denied/reduced for absence of, or exceeded, pre-certification/authorization.",Authorization/Precert,Authorization/Precert
PI63,Correction to a prior claim.,Correction,Other/Unspecified
PI64,Denial reversed per Medical Review.,Correction,Other/Unspecified
PI65,Procedure code was incorrect. This payment reflects the correct code.,Provider Billing Error,Provider Billing Error/Coding
PI66,Blood Deductible.,Patient Responsibility,Patient Responsibility/Deductible
PI67,"Lifetime reserve days. (Handled in QTY, QTY01=LA)",Provider Billing Error,Provider Billing Error/Coding
PI68,DRG weight. (Handled in CLP12),DRG/Outlier,DRG/Outlier
PI69,Day outlier amount.,DRG/Outlier,DRG/Outlier
PI7,The procedure/revenue code is inconsistent with the patient's gender.,Provider Billing Error,Provider Billing Error/Coding
PI70,Cost outlier - Adjustment to compensate for additional costs.,DRG/Outlier,DRG/Outlier
PI71,Primary Payer amount.,COB/Other Payer,COB/Other Payer
PI72,"Coinsurance day. (Handled in QTY, QTY01=CD)",Patient Responsibility,Patient Responsibility/Coinsurance
PI73,Administrative days.,DRG/Outlier,DRG/Outlier
PI74,Indirect Medical Education Adjustment.,DRG/Outlier,DRG/Outlier
PI75,Direct Medical Education Adjustment.,DRG/Outlier,DRG/Outlier
PI76,Disproportionate Share Adjustment.,DRG/Outlier,DRG/Outlier
PI77,"Covered days. (Handled in QTY, QTY01=CA)",DRG/Outlier,DRG/Outlier
PI78,Non-Covered days/room charge adjustment,Coverage/Eligibility,Coverage/Eligibility
PI79,Cost Report days. (Handled in MIA15),DRG/Outlier,DRG/Outlier
PI8,The procedure code is inconsistent with the provider type/specialty (taxonomy).,Provider Billing Error,Provider Billing Error/Coding
PI80,"Outlier days. (Handled in QTY, QTY01=OU)",DRG/Outlier,DRG/Outlier
PI81,Discharges.,DRG/Outlier,DRG/Outlier
PI82,PIP days.,DRG/Outlier,DRG/Outlier
PI83,Total visits.,DRG/Outlier,DRG/Outlier
PI84,Capital Adjustment. (Handled in MIA),DRG/Outlier,DRG/Outlier
PI85,Interest amount.,Contractual/Payment,Contractual/Payment/Other
PI86,Statutory Adjustment.,Contractual/Payment,Contractual/Payment/Other
PI87,Transfer amount.,Contractual/Payment,Contractual/Payment/Other
PI88,Adjustment amount represents collection against receivable created in prior overpayment.,Refund/Recovery,Refund/Recovery
PI89,Professional fees removed from charges.,COB/Other Payer,COB/Other Payer
PI9,The diagnosis is inconsistent with the patient's age,Provider Billing Error,Provider Billing Error/Diagnosis
PI90,Ingredient cost adjustment.,Other Insurance,Coverage/Workers Comp
PI91,Dispensing fee adjustment.,Medical Necessity/Review,Medical Necessity/Review
PI92,Claim Paid in full.,Other Insurance,Coverage/Workers Comp
PI93,No Supplementary Medical Insurance (SMI) for this patient,Coverage/Eligibility,Coverage/Eligibility
PI94,Processed in accordance with Demonstration Project,Program/Demo Adjustment,Program/Demo
PI95,Benefits adjusted. Plan procedures not followed.,Provider Billing Error,Provider Billing Error/Other
PI96,Non-covered charge(s),Coverage/Eligibility,Coverage/Eligibility
PI97,Payment is included in another service/procedure,Bundled/Inclusive,Bundled/Inclusive
PI98,The hospital must file the Medicare claim for this inpatient non-physician service.,Benefit Limits,Benefit Limits
PI99,Medicare Secondary Payer Adjustment Amount.,COB/Other Payer,COB/Other Payer
PIA0,Patient refund amount.,Refund/Recovery,Refund/Recovery
PIA1,Claim/Service denied. At least one Remark Code must be provided (may be comprised of either the Remittance Advice Remark Code or NCPDP Reject Reason Code).,Patient Responsibility,Patient Responsibility/Deductible
PIA2,Contractual adjustment.,Patient Responsibility,Patient Responsibility/Coinsurance
PIA3,Medicare Secondary Payer liability met.,COB/Other Payer,COB/Other Payer
PIA4,Medicare Claim PPS Capital Day Outlier Amount.,Provider Billing Error,Provider Billing Error/Modifier
PIA5,Medicare Claim PPS Capital Cost Outlier Amount.,Provider Billing Error,Provider Billing Error/POS
PIA6,Prior hospitalization or 30 day transfer requirement not met.,Provider Billing Error,Provider Billing Error/Coding
PIA7,The procedure/revenue code is inconsistent with the patient's gender,Provider Billing Error,Provider Billing Error/Coding
PIA8,Claim denied; ungroupable DRG,Provider Billing Error,Provider Billing Error/Coding
PIB1,Non-covered visits.,Patient Responsibility,Patient Responsibility/Deductible
PIB10,The diagnosis is inconsistent with the patient's gender,Provider Billing Error,Provider Billing Error/Diagnosis
PIB11,The diagnosis is inconsistent with the procedure,Provider Billing Error,Provider Billing Error/Diagnosis
PIB12,The diagnosis is inconsistent with the provider type,Provider Billing Error,Provider Billing Error/Diagnosis
PIB13,The date of death precedes the date of service,Provider Billing Error,Provider Billing Error/Other
PIB14,Payment denied because only one visit or consultation per physician per day is covered.,Provider Billing Error,Provider Billing Error/Other
PIB15,Payment adjusted because this service/procedure requires that a qualifying service/procedure be received and covered. The qualifying other service/procedure has not been received/adjudicated.,Authorization/Precert,Authorization/Precert
PIB16,Payment adjusted because 'New Patient' qualifications were not met.,Provider Billing Error,Provider Billing Error/Other
PIB17,"Payment adjusted because this service was not prescribed by a physician, not prescribed prior to delivery, the prescription is incomplete, or the prescription is not current.",Documentation/Attachments,Documentation/Attachments
PIB18,Payment adjusted because this procedure code and modifier were invalid on the date of service,Provider Billing Error,Provider Billing Error/Modifier
